{"candidate_universe_sha256":"ffffffffffffffffffffffffffffffffffffffffffffffffffffffffffffffff","counts_by_evidence_class":{"code":{"rejected":1,"selected":2,"unenumerated":0},"documentation":{"rejected":0,"selected":1,"unenumerated":0},"metadata":{"rejected":0,"selected":0,"unenumerated":0},"test":{"rejected":1,"selected":1,"unenumerated":0}},"descriptor_id":"desc-p0-001","descriptor_sha256":"1996a8b7890e55d832a67ee76b725840fabc34c2b3eb6ce7f10cf4d3c19cadf1","diff_base_revision_sha256":"2222222222222222222222222222222222222222222222222222222222222222","diff_basis":"range","diff_fingerprint_sha256":"3333333333333333333333333333333333333333333333333333333333333333","diff_head_or_dirty_sha256":"4444444444444444444444444444444444444444444444444444444444444444","dirty_state_fingerprint_sha256":"5555555555555555555555555555555555555555555555555555555555555555","head_revision_sha256":"6666666666666666666666666666666666666666666666666666666666666666","index_build_revision_sha256":"7777777777777777777777777777777777777777777777777777777777777777","index_contents_sha256":"8888888888888888888888888888888888888888888888888888888888888888","index_policy_version":"index-policy-v1","index_schema_version":"index-v1","isolated_worktree_identity_sha256":"9999999999999999999999999999999999999999999999999999999999999999","protected_zone_policy_version":"protected-v1","renderer_policy_version":"render-v1","repository_identity_sha256":"aaaaaaaaaaaaaaaaaaaaaaaaaaaaaaaaaaaaaaaaaaaaaaaaaaaaaaaaaaaaaaaa","schema_version":"v1","selection_snapshot_id":"snapshot-p0-001","selection_snapshot_sha256":"572adf8cf08da92af2d78a53a31e80b7abb021590baf0065819ad94b1a4f18dc","selector_policy_version":"select-v1"}
